{"config":{"core_fmt":"ternary","ctx":8,"d":8,"d_ff":8,"delta":0.5,"emb_fmt":"4bit","mlp":"gelu","n_heads":2,"n_layers":1,"qk_norm":false,"scale_policy":"row16","vocab":256},"data":{"bytes":1024,"path":"train.bin","sha256":"785b0751fc2c53dc14a4ce3d800e69ef9ce1009eb327ccf458afe09c242c26c9"},"indices":{"bytes":256,"path":"indices.bin","sha256":"34fc824ad99120fdec690834a99fd7e012d2d30d81823042c3b2f7cc601b87be"},"initialization_sha256":"df56cba3eb227f99557482769c8212a88cc9fee9d6c30d7dc3df8ffc38d03bb1","job_id":"tiny-stopped","moments":[{"first":[-0.0003080344176851213,-0.00030280451755970716,6.571361154783517e-05,-0.00011087901657447219,-9.636893082642928e-05,0.0002950647321995348,-5.130315912538208e-05,-0.0003239396901335567,-6.204354576766491e-05,-0.00031903324997983873,0.0001381403999403119,-2.101682548527606e-05,-6.931011012056842e-05,0.0003775546792894602,2.1122654288774356e-05,-8.448641892755404e-07,8.928607712732628e-06,-0.00018195222946815193,0.0003110685502178967,0.00014399600331671536,0.000135409805807285,-0.0001271335204364732,-0.00014361059584189206,0.0002507861645426601,-8.396824705414474e-05,-0.00017206159827765077,0.00013371437671594322,3.575209848349914e-05,2.6403737138025463e-05,0.00035267244675196707,4.127861757297069e-06,-5.05524076288566e-05,-6.894950638525188e-05,-6.018913700245321e-05,8.497913222527131e-05,-1.9400473320274614e-05,7.393287887680344e-06,0.00010428481618873775,1.1821648513432592e-05,9.037732525030151e-06,-0.0001704505120869726,-0.00011965003068326041,0.0002418399672023952,6.786583253415301e-05,-6.085495988372713e-05,0.0007424028590321541,-0.00016247638268396258,-0.0002659693418536335,-0.005507744383066893,-0.0015020458959043026,-0.009142826311290264,-0.01203063316643238,0.008750165812671185,0.0025225195568054914,-0.0022629762534052134,0.00010707380715757608,0.0028574636671692133,-0.0030647283419966698,-0.0036902909632772207,0.003506597364321351,-0.0006340924883261323,-0.004373913165181875,-0.0031364685855805874,-0.0014521669363602996,0.003414818085730076,-0.002508322009816766,-0.0019912593998014927,-0.0030116417910903692,0.0021894793026149273,0.0013459462206810713,-0.0020706094801425934,-0.0014408094575628638,0.0020129268523305655,-0.001492322888225317,-0.005648907274007797,-0.001014541368931532,-0.002711343578994274,-0.004226156510412693,-0.0017751279519870877,-0.00327779958024621,-0.0009047686471603811,-0.003947174642235041,0.0017374214949086308,0.0011358327465131879,0.0010740510188043118,-0.0029657394625246525,-0.002685649786144495,-0.0040273661725223064,0.004220536444336176,0.0003264316765125841,-0.003470730036497116,-0.006015704479068518,-0.0012999892933294177,-0.000805670686531812,0.006663215812295675,0.003827894339337945,-0.002849970245733857,-0.008743353188037872,-0.004153176676481962,0.0029533503111451864,-0.0013210760662332177,0.009786562994122505,0.000760170049034059,0.010984905995428562,-0.002414409536868334,0.009918547235429287,-0.0017727791564539075,-0.0014636397827416658,0.0017091153422370553,-0.0007040635100565851,1.341535426035989e-05,0.004286566749215126,0.0003931267710868269,-0.003417688189074397,-0.004490617662668228,-0.0036599321756511927,-0.0028029244858771563,0.004695093259215355,-0.0018799530807882547,0.004199308808892965,-8.199590956792235e-05,-0.0001735186524456367,0.00035016267793253064,-0.00015452523075509816,-2.6525583962211385e-05,0.0005272465059533715,3.5082033718936145e-05,0.0002507591270841658,-0.000146810183650814,-0.000139377370942384,8.953926590038463e-05,-1.128800977312494e-05,3.1232084438670427e-06,0.0001956087362486869,5.957424218649976e-05,-0.00010171822214033455,-0.0063338130712509155,-0.0021412696223706007,0.005224234890192747,-0.0035364299546927214,0.003112152451649308,-0.003402520902454853,0.0066649094223976135,-0.003417213214561343,-0.01555132307112217,-0.003022711258381605,0.013060756027698517,0.010553748346865177,0.0007944083190523088,0.007685230113565922,0.02795347012579441,0.0009341203258372843,-0.004424883518368006,0.0039164223708212376,-0.003058516187593341,-0.006124194711446762,-0.002519127679988742,0.0023675470147281885,0.0029042258393019438,-0.009926978498697281,-0.005306962877511978,0.0036350490991026163,0.00333972554653883,-0.003843420883640647,-0.00037740281550213695,-0.0032859272323548794,0.0013092142762616277,0.008126074448227882,-0.003648255253210664,0.01090844813734293,-0.0032501709647476673,0.0038472311571240425,-0.001867793034762144,0.0032910523004829884,-0.0028093617875128984,-0.003688294440507889,0.007333163172006607,0.006955794990062714,-0.0051610576920211315,-0.006907050963491201,-0.007998544722795486,0.005600898060947657,-0.00038876308826729655,0.006540208589285612,0.0004152183246333152,0.00033980817534029484,0.0031429247464984655,0.003460381180047989,0.0006222359370440245,-0.006555704865604639,-0.00218890025280416,-0.007396748289465904,0.0019325955072417855,0.001556783216074109,-0.006909279152750969,-0.0031040795147418976,-0.004900586791336536,0.01105742808431387,0.003644084557890892,-0.0010656106751412153,-0.0021500829607248306,-0.00252730050124228,-0.0024030033964663744,0.002029472729191184,0.0015133811393752694,-0.004171126522123814,0.002038974082097411,-0.006949476897716522,1.88615704246331e-05,-8.173845708370209e-05,0.00022394570987671614,6.956321885809302e-05,-0.00011338866897858679,0.000277353246929124,-0.000103610975202173,-0.00020051372121088207,4.766231086250627e-06,2.0584797312039882e-05,0.00012074848200427368,7.874369475757703e-05,2.6053410692838952e-05,2.494756154192146e-05,-9.65794242802076e-05,-1.841498124122154e-05,-9.179628978017718e-05,0.00010846456279978156,0.00020303392375353724,2.7283538656774908e-05,-4.779874871019274e-06,0.00010710476635722443,-1.592773332959041e-05,-0.00022252241615206003,-0.00012728296860586852,-0.0002155908732675016,0.00011004271800629795,-4.1272967791883275e-05,-0.00011373494635336101,0.0002998666022904217,9.451596270082518e-06,-0.00021825655130669475,-0.00021584189380519092,-0.00023518422676716,0.00010752186790341511,-0.00014345700037665665,-4.0013699617702514e-05,0.00017298778402619064,3.2000425562728196e-05,-8.744947263039649e-05,-0.00010314145038137212,3.342401032568887e-05,0.00020147676696069539,-0.00014895934145897627,-2.9759889002889395e-05,0.00010269424092257395,0.00010885242227232084,-1.3578130165114999e-05,-6.041028973413631e-05,-0.00010348808427806944,9.754810889717191e-05,-1.145997885032557e-05,-2.7542864700080827e-06,-7.03354089637287e-06,-2.5068198738154024e-05,-2.7201123884879053e-05,-7.735047256574035e-05,0.00010087567352456972,0.00027679820777848363,-0.00011187796189915389,7.362260657828301e-05,-6.521550676552579e-05,0.00010067540279123932,0.00011034927592845634,-7.172211917350069e-05,-2.949484041891992e-05,0.0001381802576361224,-9.689925354905427e-05,-0.00014912011101841927,0.00017483286501374096,-4.031288335681893e-05,-0.00016171169409062713,-0.00010399627353763208,0.00010571166058070958,0.00020323209173511714,-0.0001044417658704333,-8.473225170746446e-05,-2.2726300812792033e-05,5.339331619325094e-05,-0.00024275918258354068,-5.3137038776185364e-05,2.361328552069608e-05,0.0001284386235056445,-6.499147275462747e-05,-2.8528800612548366e-05,-3.3591750252526253e-05,7.110475053195842e-06,-8.117590914480388e-05,-0.00015043765597511083,0.0001052631123457104,0.0002505572629161179,0.00019015198631677777,0.0001729561190586537,-0.00010056441533379257,6.492493412224576e-05,-0.00017070355534087867,-0.0001094550098059699,-3.3105359761975706e-05,0.0001269014028366655,7.327701314352453e-05,3.310374449938536e-05,-6.545439100591466e-05,-3.603739969548769e-05,-0.00013446618686430156,-0.00014517639647237957,-3.1038060114951804e-05,6.075040437281132e-05,-0.00010944395035039634,-1.2089385563740507e-05,5.792491720058024e-05,-1.0352232493460178e-06,-5.761276770499535e-05,-0.00015020061982795596,-5.1749073463724926e-05,0.00027750199660658836,0.00018807491869665682,0.00018159931642003357,0.0002482416748534888,4.732304660137743e-05,-0.00012094079283997416,-0.00024837825912982225,0.0002654969284776598,0.0004776743007823825,0.00017888520960696042,0.00018396037921775132,-0.0003848664928227663,0.0001362377661280334,-0.00033421459374949336,3.0819963285466656e-05,0.00013459463662002236,0.00023665977641940117,5.620440060738474e-05,5.769416020484641e-05,-1.886272912088316e-06,-0.0001078783388948068,0.00016581757517997175,-1.9624081687652506e-05,-0.00013672483328264207,4.4608546886593103e-05,-0.00023826953838579357,-0.00010905484668910503,8.365824760403484e-05,0.00010564338299445808,1.7303904314758256e-05,4.3473028199514374e-07,5.490580224432051e-05,0.0003482010797597468,7.381277828244492e-05,8.685814100317657e-05,0.0003848090418614447,-8.950730261858553e-05,0.00030434931977652013,6.561345799127594e-06,-7.498047489207238e-05,0.00017475038475822657,-0.00010031441343016922,-6.449856300605461e-05,6.360754923662171e-05,-1.445730867999373e-05,4.0336519305128604e-05,-1.8814151189872064e-05,4.3845931941177696e-05,0.00023569057520944625,0.00014840711082797498,0.00010541665687924251,-6.916679558344185e-05,-6.134683644631878e-05,2.688057611521799e-05,-0.00013257545651867986,-0.00017676723655313253,5.10921745444648e-05,-0.0001936194021254778,-0.00013220506662037224,0.00022945343516767025,5.965644959360361e-06,-5.192168464418501e-05,-4.317147977417335e-05,9.472264355281368e-05,0.00038868977571837604,0.00017644348554313183,0.00016902884817682207,-0.00024290848523378372,-3.2954812922980636e-05,2.5381970772286877e-05,-3.006821862072684e-05,0.0005775839672423899,0.0004095576296094805,-0.00022875936701893806,-0.000188079007784836,-5.5681455705780536e-05,9.779584070201963e-05,-0.0005166854243725538,-0.0003224356914870441,0.00010846382065210491,0.00030630838591605425,-0.00043941487092524767,-1.7127575119957328e-05,-6.709505396429449e-05,0.00020808236149605364,-0.00020279371528886259,0.00022531417198479176,-0.00040180340874940157,0.00035097863292321563,-7.88682336860802e-06,-1.805178908398375e-05,5.1055438234470785e-05,4.744531906908378e-05,0.00026909023290500045,-6.584075890714303e-05,4.202760828775354e